{
  "dataset": "ECHV",
  "version": "accepted-release",
  "generated_at": "YYYY-MM-DD",
  "blind_period_status": "active",
  "splits": {
    "protected_blind": {
      "guid_file": "protected_guids_blind.txt",
      "guid_count": 350,
      "label_visibility": "withheld_until_blind_period_ends",
      "notes": "Protected GUIDs and labels are released after the blind period ends, subject to third-party redistribution constraints."
    }
  }
}
